PostgreSQL research

using smartctl , hdparm command get hardisk info in linux environment

2010-08-01 8:44:49   查看原文>>

昨天在京东上买了个显示器和一个WD的硬盘。
来简单的检测一下硬盘的状态，
首先要用到的是hdparm，这个命令的作用是设置或获取硬盘参数。
hdparm  provides  a  command  line  interface  to various hard disk ioctls supported by the stock Linux ATA/IDE device driver subsystem.  
Some options may work correctly only with the latest kernels.  For best results, compile hdparm with the include files from the latest kernel source code.
这里要用到的是如下参数：
    -i     Display the identification info that was obtained from the drive at boot time, if available.  This is  a
              feature  of  modern IDE drives, and may not be supported by older devices.  The data returned may or may
              not be current, depending on activity since booting the system.  However, the  current  multiple  sector
              mode  count is always shown.  For a more detailed interpretation of the identification info, refer to AT
              Attachment Interface for Disk Drives (ANSI ASC X3T9.2 working draft, revision 4a, April 19/93).

       -I     Request identification info directly from the drive, which is displayed in a new  expanded  format  with
              considerably more detail than with the older -i flag
[root@digoal win_c]# hdparm -I /dev/sda

/dev/sda:

ATA device, with non-removable media
        Model Number:       WDC WD5000AADS-00S9B0                   
        Serial Number:      WD-WCAV94074040
        Firmware Revision:  01.00A01
Transport: Serial, SATA 1.0a, SATA II Extensions, SATA Rev 2.5
Standards:
        Supported: 8 7 6 5 
        Likely used: 8
Configuration:
        Logical         max     current
        cylinders       16383   16383
        heads           16      16
        sectors/track   63      63
        --
        CHS current addressable sectors:   16514064
        LBA    user addressable sectors:  268435455
        LBA48  user addressable sectors:  976773168
        device size with M = 1024*1024:      476940 MBytes
        device size with M = 1000*1000:      500107 MBytes (500 GB)
Capabilities:
        LBA, IORDY(can be disabled)
        Queue depth: 32
        Standby timer values: spec'd by Standard, with device specific minimum
        R/W multiple sector transfer: Max = 16  Current = 16
        Recommended acoustic management value: 128, current value: 254
        DMA: mdma0 mdma1 mdma2 udma0 udma1 udma2 udma3 udma4 udma5 *udma6 
             Cycle time: min=120ns recommended=120ns
        PIO: pio0 pio1 pio2 pio3 pio4 
             Cycle time: no flow control=120ns  IORDY flow control=120ns
Commands/features:
        Enabled Supported:
           *    SMART feature set
                Security Mode feature set
           *    Power Management feature set
           *    Write cache
           *    Look-ahead
           *    Host Protected Area feature set
           *    WRITE_BUFFER command
           *    READ_BUFFER command
           *    NOP cmd
           *    DOWNLOAD_MICROCODE
                Power-Up In Standby feature set
           *    SET_FEATURES required to spinup after power up
                SET_MAX security extension
                Automatic Acoustic Management feature set
           *    48-bit Address feature set
           *    Device Configuration Overlay feature set
           *    Mandatory FLUSH_CACHE
           *    FLUSH_CACHE_EXT
           *    SMART error logging
           *    SMART self-test
           *    General Purpose Logging feature set
           *    64-bit World wide name
           *    WRITE_UNCORRECTABLE command
           *    {READ,WRITE}_DMA_EXT_GPL commands
           *    Segmented DOWNLOAD_MICROCODE
           *    SATA-I signaling speed (1.5Gb/s)
           *    SATA-II signaling speed (3.0Gb/s)
           *    Native Command Queueing (NCQ)
           *    Host-initiated interface power management
           *    Phy event counters
           *    unknown 76[12]
                DMA Setup Auto-Activate optimization
           *    Software settings preservation
Security: 
        Master password revision code = 65534
                supported
        not     enabled
        not     locked
                frozen
        not     expired: security count
                supported: enhanced erase
        110min for SECURITY ERASE UNIT. 110min for ENHANCED SECURITY ERASE UNIT.
Checksum: correct
[root@digoal win_c]# hdparm -i /dev/sda

/dev/sda:

 Model=WDC WD5000AADS-00S9B0                   , FwRev=01.00A01, SerialNo=     WD-WCAV94074040
 Config={ HardSect NotMFM HdSw>15uSec SpinMotCtl Fixed DTR>5Mbs FmtGapReq }
 RawCHS=16383/16/63, TrkSize=0, SectSize=0, ECCbytes=50
 BuffType=unknown, BuffSize=32767kB, MaxMultSect=16, MultSect=?16?
 CurCHS=16383/16/63, CurSects=16514064, LBA=yes, LBAsects=268435455
 IORDY=on/off, tPIO={min:120,w/IORDY:120}, tDMA={min:120,rec:120}
 PIO modes:  pio0 pio3 pio4 
 DMA modes:  mdma0 mdma1 mdma2 
 UDMA modes: udma0 udma1 udma2 
 AdvancedPM=no WriteCache=enabled
 Drive conforms to: Unspecified:  ATA/ATAPI-1 ATA/ATAPI-2 ATA/ATAPI-3 ATA/ATAPI-4 ATA/ATAPI-5 ATA/ATAPI-6 ATA/ATAPI-7

 * signifies the current active mode

另外一个要用到的工具是smartctl
DESCRIPTION
       smartctl  controls  the Self-Monitoring, Analysis and Reporting Technology (SMART) system built into many ATA-3
       and later ATA, IDE and SCSI-3 hard drives. The purpose of SMART is to monitor the reliability of the hard drive
       and  predict drive failures, and to carry out different types of drive self-tests.  This version of smartctl is
       compatible with ATA/ATAPI-7 and earlier standards (see REFERENCES below)

       smartctl is a command line utility designed to perform SMART tasks such as printing  the  SMART  self-test  and
       error logs, enabling and disabling SMART automatic testing, and initiating device self-tests. Note: if the user
       issues a SMART command that is (apparently) not implemented by the device, smartctl will print a  warning  mes-
       sage  but  issue the command anyway (see the -T, --tolerance option below).  This should not cause problems: on
       most devices, unimplemented SMART commands issued to a drive are ignored and/or return an error.

       smartctl also provides support for polling TapeAlert messages from SCSI tape drives and changers.

[root@digoal win_c]# smartctl -a /dev/sda
smartctl version 5.38 [x86_64-redhat-linux-gnu] Copyright (C) 2002-8 Bruce Allen
Home page is http://smartmontools.sourceforge.net/

=== START OF INFORMATION SECTION ===
Device Model:     WDC WD5000AADS-00S9B0
Serial Number:    WD-WCAV94074040
Firmware Version: 01.00A01
User Capacity:    500,107,862,016 bytes
Device is:        Not in smartctl database [for details use: -P showall]
ATA Version is:   8
ATA Standard is:  Exact ATA specification draft version not indicated
Local Time is:    Sun Aug  1 08:50:35 2010 CST
SMART support is: Available - device has SMART capability.
SMART support is: Enabled

=== START OF READ SMART DATA SECTION ===
SMART overall-health self-assessment test result: PASSED

General SMART Values:
Offline data collection status:  (0x80) Offline data collection activity
                                        was never started.
                                        Auto Offline Data Collection: Enabled.
Self-test execution status:      (   0) The previous self-test routine completed
                                        without error or no self-test has ever 
                                        been run.
Total time to complete Offline 
data collection:                 (10800) seconds.
Offline data collection
capabilities:                    (0x7b) SMART execute Offline immediate.
                                        Auto Offline data collection on/off support.
                                        Suspend Offline collection upon new
                                        command.
                                        Offline surface scan supported.
                                        Self-test supported.
                                        Conveyance Self-test supported.
                                        Selective Self-test supported.
SMART capabilities:            (0x0003) Saves SMART data before entering
                                        power-saving mode.
                                        Supports SMART auto save timer.
Error logging capability:        (0x01) Error logging supported.
                                        General Purpose Logging supported.
Short self-test routine 
recommended polling time:        (   2) minutes.
Extended self-test routine
recommended polling time:        ( 127) minutes.
Conveyance self-test routine
recommended polling time:        (   5) minutes.
SCT capabilities:              (0x303f) SCT Status supported.
                                        SCT Feature Control supported.
                                        SCT Data Table supported.

SMART Attributes Data Structure revision number: 16
Vendor Specific SMART Attributes with Thresholds:
ID# ATTRIBUTE_NAME          FLAG     VALUE WORST THRESH TYPE      UPDATED  WHEN_FAILED RAW_VALUE
  1 Raw_Read_Error_Rate     0x002f   100   253   051    Pre-fail  Always       -       0
  3 Spin_Up_Time            0x0027   145   145   021    Pre-fail  Always       -       3716
  4 Start_Stop_Count        0x0032   100   100   000    Old_age   Always       -       10
  5 Reallocated_Sector_Ct   0x0033   200   200   140    Pre-fail  Always       -       0
  7 Seek_Error_Rate         0x002e   100   253   000    Old_age   Always       -       0
  9 Power_On_Hours          0x0032   100   100   000    Old_age   Always       -       0
 10 Spin_Retry_Count        0x0032   100   253   000    Old_age   Always       -       0
 11 Calibration_Retry_Count 0x0032   100   253   000    Old_age   Always       -       0
 12 Power_Cycle_Count       0x0032   100   100   000    Old_age   Always       -       8
192 Power-Off_Retract_Count 0x0032   200   200   000    Old_age   Always       -       7
193 Load_Cycle_Count        0x0032   200   200   000    Old_age   Always       -       9
194 Temperature_Celsius     0x0022   102   102   000    Old_age   Always       -       41
196 Reallocated_Event_Count 0x0032   200   200   000    Old_age   Always       -       0
197 Current_Pending_Sector  0x0032   200   200   000    Old_age   Always       -       0
198 Offline_Uncorrectable   0x0030   100   253   000    Old_age   Offline      -       0
199 UDMA_CRC_Error_Count    0x0032   200   253   000    Old_age   Always       -       0
200 Multi_Zone_Error_Rate   0x0008   100   253   000    Old_age   Offline      -       0

SMART Error Log Version: 1
No Errors Logged

SMART Self-test log structure revision number 1
No self-tests have been logged.  [To run self-tests, use: smartctl -t]


SMART Selective self-test log data structure revision number 1
 SPAN  MIN_LBA  MAX_LBA  CURRENT_TEST_STATUS
    1        0        0  Not_testing
    2        0        0  Not_testing
    3        0        0  Not_testing
    4        0        0  Not_testing
    5        0        0  Not_testing
Selective self-test flags (0x0):
  After scanning selected spans, do NOT read-scan remainder of disk.
If Selective self-test is pending on power-up, resume after 0 minute delay.

下面是另外一位兄弟写的smartctl的用法，更加详细。
1.1 什么是Smartmontools？

Smartmontools是一种硬盘检测工具，通过控制和管理硬盘的SMART（Self Monitoring Analysis and Reporting Technology，自动检测分析及报告技术）技术来实现的，SMART技术可以对硬盘的磁头单元、盘片电机驱动系统、硬盘内部电路以及盘片表面介质材料等进行监测，当SMART监测并分析出硬盘可能出现问题时会及时向用户报警以避免计算机数据受损失。
SMART技术必须在主板支持的前提下才能发生作用，而且 SMART技术也不能保证能预报所有可能发生的硬盘故障。SMART(SFF-8035i) 是硬盘生产商们建立的一个工业标准，这个标准就是在硬盘上保存一个跟执行情况，可靠程度，读找错误率等属性的表格。所有属性都有一个1byte(大小范围1-253)的标准化值，还包含另一个1byte的关键阶段值，如果属性表格内某
个数据接近小于或达到关键阶段值，表明硬盘工作不正常了。

2.1 Smartmontools的使用

1、启动监控进程

# /etc/init.d/smartd start
启动 smartd：                                              [  确定  ]
2、检查硬盘是否支持SMART 1993年以后出厂的硬盘基本上都支持SMART技术，使用如下命令可以来查看：

# smartctl -i /dev/hdb
smartctl version 5.33 [i686-turbo-linux-gnu] Copyright (C) 2002-4 Bruce Allen
Home page is http://smartmontools.sourceforge.net/

=== START OF INFORMATION SECTION ===
Device Model:     ST3160212A
Serial Number:    5LS2EDKN
Firmware Version: 3.AAE
User Capacity:    160,041,885,696 bytes
Device is:        Not in smartctl database [for details use: -P showall]
ATA Version is:   7
ATA Standard is:  Exact ATA specification draft version not indicated
Local Time is:    Mon Sep 17 02:13:37 2007 CST
SMART support is: Available - device has SMART capability.
SMART support is: Enabled
在上面的信息可以看到，该硬盘是支持SMART技术，且当前是开启的。如果SMART support is: Disabled表示SMART未启用，执行如下命令，启动SMART：

smartctl --smart=on --offlineauto=on --saveauto=on /dev/hdb
3、检查硬盘健康状态

# smartctl -H /dev/hdb
smartctl version 5.33 [i686-turbo-linux-gnu] Copyright (C) 2002-4 Bruce Allen
Home page is http://smartmontools.sourceforge.net/

=== START OF READ SMART DATA SECTION ===
SMART overall-health self-assessment test result: PASSED
请注意result后边的结果：PASSED，这表示硬盘健康状态良好，如果这里显示Failure，那么最好立刻给服务器更换硬盘。SMART只能报告磁盘已经不再健康，但是报警后还能继续运行多久是不确定的，通常，SMART报警参数是有预留的，磁盘报警后，不会当场坏掉，一般能坚持一段时间，有的硬盘SMART报警后还继续跑了好几年，有的硬盘SMART报错后几天就坏了
，千万不要存在侥幸心理。执行如下命令可以看到详细的参数：

# smartctl -A /dev/hdb
smartctl version 5.33 [i686-turbo-linux-gnu] Copyright (C) 2002-4 Bruce Allen
Home page is http://smartmontools.sourceforge.net/

=== START OF READ SMART DATA SECTION ===
SMART Attributes Data Structure revision number: 10
Vendor Specific SMART Attributes with Thresholds:
ID# ATTRIBUTE_NAME          FLAG     VALUE WORST THRESH TYPE      UPDATED  WHEN_FAILED RAW_VALUE
  1 Raw_Read_Error_Rate     0x000f   114   100   006    Pre-fail  Always       -       81812244
  3 Spin_Up_Time            0x0003   100   099   000    Pre-fail  Always       -       0
  4 Start_Stop_Count        0x0032   100   100   020    Old_age   Always       -       257
  5 Reallocated_Sector_Ct   0x0033   100   100   036    Pre-fail  Always       -       0
  7 Seek_Error_Rate         0x000f   078   060   030    Pre-fail  Always       -       64781708
  9 Power_On_Hours          0x0032   096   096   000    Old_age   Always       -       4365
 10 Spin_Retry_Count        0x0013   100   100   097    Pre-fail  Always       -       0
 12 Power_Cycle_Count       0x0032   100   100   020    Old_age   Always       -       276
187 Unknown_Attribute       0x0032   100   100   000    Old_age   Always       -       0
189 Unknown_Attribute       0x003a   100   100   000    Old_age   Always       -       0
190 Unknown_Attribute       0x0022   058   053   045    Old_age   Always       -       773324842
194 Temperature_Celsius     0x0022   042   047   000    Old_age   Always       -       42 (Lifetime Min/Max 0/21)
195 Hardware_ECC_Recovered  0x001a   052   048   000    Old_age   Always       -       1562815
197 Current_Pending_Sector  0x0012   100   100   000    Old_age   Always       -       0
198 Offline_Uncorrectable   0x0010   100   100   000    Old_age   Offline      -       0
199 UDMA_CRC_Error_Count    0x003e   200   200   000    Old_age   Always       -       0
200 Multi_Zone_Error_Rate   0x0000   100   253   000    Old_age   Offline      -       0
202 TA_Increase_Count       0x0032   100   253   000    Old_age   Always       -       0
FLAG是标记，标准数值(VALUE)应当小于或等於关键值(THRESH)。WHEN_FAILED 代表错误信息，上面显示的WHEN_FAILED纵行是空行，说明硬盘没有故障。如果WHEN_FAILED显示数字，表明硬盘磁道可能有比较大的坏道。

4、对硬盘进行检测手工对硬盘进行测试的方法有以下四种：

smartctl -t short <device>    后台检测硬盘，消耗时间短
smartctl -t long <device>      后台检测硬盘，消耗时间长
smartctl -C -t short <device> 前台检测硬盘，消耗时间短
smartctl -C -t long <device>  前台检测硬盘，消耗时间长
例如，在后台对硬盘进行详细的检查，命令如下：

# smartctl -t long /dev/hdb
smartctl version 5.33 [i686-turbo-linux-gnu] Copyright (C) 2002-4 Bruce Allen
Home page is http://smartmontools.sourceforge.net/

=== START OF OFFLINE IMMEDIATE AND SELF-TEST SECTION ===
Sending command: "Execute SMART Extended self-test routine immediately in off-line mode".
Drive command "Execute SMART Extended self-test routine immediately in off-line mode" successful.
Testing has begun.
Please wait 54 minutes for test to complete.
Test will complete after Mon Sep 17 03:53:32 2007

Use smartctl -X to abort test.
上面的信息显示54分钟后将完成检查，同时可以使用 smartctl -X 终止检查。终止硬盘检查命令的使用方法是：

# smartctl -X /dev/hdb
smartctl version 5.33 [i686-turbo-linux-gnu] Copyright (C) 2002-4 Bruce Allen
Home page is http://smartmontools.sourceforge.net/

=== START OF OFFLINE IMMEDIATE AND SELF-TEST SECTION ===
Sending command: "Abort SMART off-line mode self-test routine".
Self-testing aborted!
5、查看硬盘日志使用“smartctl -l logtype <device>”可以查看硬盘的日志，日志又分为多种类型，如selftest、error等等。例如查看硬盘检测的日志，如下：

# smartctl -l selftest /dev/hdb
smartctl version 5.33 [i686-turbo-linux-gnu] Copyright (C) 2002-4 Bruce Allen
Home page is http://smartmontools.sourceforge.net/

=== START OF READ SMART DATA SECTION ===
SMART Self-test log structure revision number 1
Num  Test_Description    Status                  Remaining  LifeTime(hours)  LBA_of_first_error
# 1  Extended offline    Aborted by host               90%      4365         -
# 2  Extended offline    Completed without error       00%      4247         -
# 3  Short offline       Aborted by host               30%      4246         -
# 4  Short offline       Aborted by host               10%      4246         -
# 5  Extended offline    Completed without error       00%      4229         -
查看硬盘错误日志：

# smartctl -l error /dev/hdb
smartctl version 5.33 [i686-turbo-linux-gnu] Copyright (C) 2002-4 Bruce Allen
Home page is http://smartmontools.sourceforge.net/

=== START OF READ SMART DATA SECTION ===
SMART Error Log Version: 1
No Errors Logged
